{
  "created_at": "2026-07-31T16:01:00Z",
  "distribution_approval_record_id": null,
  "distribution_state": "not_approved_for_distribution",
  "export_id": "c4fd2c8d-8419-54f2-aca9-24f4fe2b1ee3",
  "export_purpose": "leadership_distribution_review",
  "file_hash": "sha256:4ce769b8639a1edfd0e47049ae0898a138381ae66bcf6733af96b9d6023394f5",
  "file_name": "43ac6c58-2d9f-5465-91a5-b7ac00e75e8f-leadership-review.json",
  "media_type": "application/json",
  "report_package_hash": "sha256:430233c423d65642bdebde1d9217517d7023bc2ddcc5dbbf89ebe361d9ceeb4a",
  "report_package_id": "43ac6c58-2d9f-5465-91a5-b7ac00e75e8f"
}
